{
  "schema_version": "1.0",
  "evidence_id": "release-v0.6.0-published",
  "evidence_type": "release_status",
  "component": {"id": "frankie_core_release", "name": "Frankie Core Release"},
  "status": "RELEASED",
  "severity": "INFO",
  "mode": "offline",
  "data_source": "documented_evidence",
  "summary": "Frankie Core v0.6.0 is the latest published stable release.",
  "details": {"release": "v0.6.0", "published": true, "current_development_version": "0.7.0-dev"},
  "references": ["docs/releases/v0.6.0.md", "docs/evidencias/frankie-core-v0.6.0/release_publication_report.md"],
  "server_impact": {
    "touches_physical_server": false,
    "requires_live_connection": false,
    "changes_configuration": false
  },
  "security": {
    "contains_secrets": false,
    "contains_credentials": false,
    "contains_internal_ips": false
  },
  "recommendation": "Keep v0.6.0 as the stable reference while v0.7.0 remains in development."
}
